{
  "schema_version": "0.1.0",
  "style_id": "lov-laozhang-style-media-creator",
  "display_name": "老张心理风格短视频",
  "version": "0.1.0",
  "status": "ready_with_limits",
  "training_sample_ids": [
    "6abf912a000000001b0305b4",
    "6ab4292f0000000014003d92",
    "6aaa8d79000000002901bb33",
    "6aa2915d0000000025034163",
    "6a8eb2d800000000200363a9",
    "6a7879970000000026035790",
    "6a68970e000000000401f3f7",
    "6a1ac97b00000000350322e7"
  ],
  "holdout_sample_ids": [
    "6a12b933000000000702154a",
    "69e5f169000000002301014b"
  ],
  "samples": [
    {
      "sample_id": "6abf912a000000001b0305b4",
      "rank": 1,
      "title": "一个「低认知父母」的超典型认知模式",
      "source_url": "https://www.xiaohongshu.com/explore/6abf912a000000001b0305b4",
      "sha256": "ac6748ea171ef38b09076ac91bee02272e4fe286414c0682426c9ac276a9ebb7",
      "duration_seconds": 569.816236,
      "partition": "train"
    },
    {
      "sample_id": "6ab4292f0000000014003d92",
      "rank": 2,
      "title": "只想收获「好妈妈」的成功果实，但不想努力",
      "source_url": "https://www.xiaohongshu.com/explore/6ab4292f0000000014003d92",
      "sha256": "912435b2dc68ea5ec6ead0185cc9ed46beeda1007de5a1cdded59426d6647c97",
      "duration_seconds": 455.157551,
      "partition": "train"
    },
    {
      "sample_id": "6aaa8d79000000002901bb33",
      "rank": 3,
      "title": "这个时代，所有人都应该掌握这种能力",
      "source_url": "https://www.xiaohongshu.com/explore/6aaa8d79000000002901bb33",
      "sha256": "d5262975e3cf10358c3463f7724b2acfbf64a849af8f62cddce42ec8a5d18ec6",
      "duration_seconds": 525.744762,
      "partition": "train"
    },
    {
      "sample_id": "6aa2915d0000000025034163",
      "rank": 4,
      "title": "感情中总是遇人不淑的女生，都应该看懂这个",
      "source_url": "https://www.xiaohongshu.com/explore/6aa2915d0000000025034163",
      "sha256": "c06c0f376bc8c0b7a5b13dbd2e29b92fcb584b61de3e6e10e4a1b3a894515900",
      "duration_seconds": 510.026304,
      "partition": "train"
    },
    {
      "sample_id": "6a8eb2d800000000200363a9",
      "rank": 5,
      "title": "蓝盈莹积极阳光的背面，是一场「自我霸凌」",
      "source_url": "https://www.xiaohongshu.com/explore/6a8eb2d800000000200363a9",
      "sha256": "ef254e2a809598a1c16abb138753026a640fddf86e94fefd229d36e84d93cff1",
      "duration_seconds": 486.713469,
      "partition": "train"
    },
    {
      "sample_id": "6a7879970000000026035790",
      "rank": 6,
      "title": "冉莹颖怎么扭转口碑，提升商业价值？",
      "source_url": "https://www.xiaohongshu.com/explore/6a7879970000000026035790",
      "sha256": "f7721dbc08d5b9775d768dc02e2debd7bb665936a2e268f2d2152e1989119ce7",
      "duration_seconds": 321.526712,
      "partition": "train"
    },
    {
      "sample_id": "6a68970e000000000401f3f7",
      "rank": 7,
      "title": "冉莹颖的匮乏，源自两套底层信念",
      "source_url": "https://www.xiaohongshu.com/explore/6a68970e000000000401f3f7",
      "sha256": "8772e9f8de91e7f07775fc42b1ad70e6a90e7953cc05bc5d79059500ba3b3d7b",
      "duration_seconds": 524.514104,
      "partition": "train"
    },
    {
      "sample_id": "6a1ac97b00000000350322e7",
      "rank": 8,
      "title": "这种人看起来事业有成，但其实是个巨婴",
      "source_url": "https://www.xiaohongshu.com/explore/6a1ac97b00000000350322e7",
      "sha256": "32acd545070563ac612f5f9a9acc83df73a7bf90c917ca552dff6692d775a46e",
      "duration_seconds": 420.118639,
      "partition": "train"
    },
    {
      "sample_id": "6a12b933000000000702154a",
      "rank": 9,
      "title": "孙杨，一个内在世界随时要崩塌的世界冠军",
      "source_url": "https://www.xiaohongshu.com/explore/6a12b933000000000702154a",
      "sha256": "afc6b0b210337fce858fb273499ff45fd379d1adbdc5bac710108432fff4e7fe",
      "duration_seconds": 345.116735,
      "partition": "holdout"
    },
    {
      "sample_id": "69e5f169000000002301014b",
      "rank": 10,
      "title": "他俩要是离了，真就遇不上更适合彼此的人了",
      "source_url": "https://www.xiaohongshu.com/explore/69e5f169000000002301014b",
      "sha256": "75fc90d7cb598a9849ecdeb913df45f7514d830a93ee46462ea42acd9c747c42",
      "duration_seconds": 407.267846,
      "partition": "holdout"
    }
  ],
  "dimensions": [
    {
      "id": "thinking",
      "summary": "行为→机制假设→自我理解与选择"
    },
    {
      "id": "narrative",
      "summary": "案例/概念/识别/后续策略四种变体"
    },
    {
      "id": "language",
      "summary": "口语解释、对照、因果桥梁、代入与具象类比"
    },
    {
      "id": "delivery",
      "summary": "高文本密度，解释性清晰人声；采样听感不等同全片"
    },
    {
      "id": "visual",
      "summary": "室内直面镜头，横竖版和卡片变体分开"
    },
    {
      "id": "subtitles",
      "summary": "短分句、高对比、克制的暖色重点"
    },
    {
      "id": "editing_audio",
      "summary": "语义驱动切换、人声优先、安全母带"
    },
    {
      "id": "coupling",
      "summary": "按语义和最终口播时间线组织字幕与证据画面"
    }
  ],
  "rules": [
    {
      "id": "thinking.mechanism",
      "dimension": "thinking",
      "observation": "训练样本反复从可见行为/常见观念转向认知、需求、恐惧或信念的解释。",
      "instruction": "给出可核查的具体行为，再提出一种机制解释；区分观察与假设，不把读心或诊断当事实。",
      "strength": "preferred",
      "evidence_ids": [
        "E0001",
        "E0002",
        "E0003",
        "E0004",
        "E0005",
        "E0006",
        "E0007",
        "E0008"
      ],
      "support_sample_ids": [
        "6a1ac97b00000000350322e7",
        "6a68970e000000000401f3f7",
        "6a7879970000000026035790",
        "6a8eb2d800000000200363a9",
        "6aa2915d0000000025034163",
        "6aaa8d79000000002901bb33",
        "6ab4292f0000000014003d92",
        "6abf912a000000001b0305b4"
      ],
      "support_count": 8,
      "eligible_sample_count": 8,
      "confidence": "high",
      "scope": "适用于本风格生成；遵循事实和身份边界",
      "exceptions": [],
      "validation": {
        "method": "semantic review with timestamp evidence",
        "criterion": "给出可核查的具体行为，再提出一种机制解释；区分观察与假设，不把读心或诊断当事实。"
      }
    },
    {
      "id": "thinking.agency",
      "dimension": "thinking",
      "observation": "解释后反复回到自我理解、主动行动或选择，而不止于评判他人。",
      "instruction": "让观众知道能观察什么、能选择什么；保留边界与多因素解释。",
      "strength": "preferred",
      "evidence_ids": [
        "E0009",
        "E0010",
        "E0011",
        "E0012",
        "E0013",
        "E0014",
        "E0015",
        "E0016"
      ],
      "support_sample_ids": [
        "6a1ac97b00000000350322e7",
        "6a68970e000000000401f3f7",
        "6a7879970000000026035790",
        "6a8eb2d800000000200363a9",
        "6aa2915d0000000025034163",
        "6aaa8d79000000002901bb33",
        "6ab4292f0000000014003d92",
        "6abf912a000000001b0305b4"
      ],
      "support_count": 8,
      "eligible_sample_count": 8,
      "confidence": "high",
      "scope": "适用于本风格生成；遵循事实和身份边界",
      "exceptions": [],
      "validation": {
        "method": "semantic review with timestamp evidence",
        "criterion": "让观众知道能观察什么、能选择什么；保留边界与多因素解释。"
      }
    },
    {
      "id": "thinking.understand_not_excuse",
      "dimension": "thinking",
      "observation": "案例拆解中存在理解动机但不等于原谅、站队或单纯宣泄的区分。",
      "instruction": "共情可以和边界并存；解释原因不能替伤害免责，也不要责备受害者。",
      "strength": "preferred",
      "evidence_ids": [
        "E0017",
        "E0018",
        "E0019",
        "E0020"
      ],
      "support_sample_ids": [
        "6a68970e000000000401f3f7",
        "6a7879970000000026035790",
        "6aa2915d0000000025034163",
        "6ab4292f0000000014003d92"
      ],
      "support_count": 4,
      "eligible_sample_count": 8,
      "confidence": "high",
      "scope": "适用于本风格生成；遵循事实和身份边界",
      "exceptions": [
        "概念教学不必强插站队声明。"
      ],
      "validation": {
        "method": "semantic review with timestamp evidence",
        "criterion": "共情可以和边界并存；解释原因不能替伤害免责，也不要责备受害者。"
      }
    },
    {
      "id": "narrative.direct_open",
      "dimension": "narrative",
      "observation": "概念/识别型样本直接给能力定义或反常识识别，不先寒暄。",
      "instruction": "开头用一句可辨认的判断或冲突承诺本片要解释什么，不加空泛自我介绍。",
      "strength": "preferred",
      "evidence_ids": [
        "E0021",
        "E0022",
        "E0023"
      ],
      "support_sample_ids": [
        "6a1ac97b00000000350322e7",
        "6a8eb2d800000000200363a9",
        "6aaa8d79000000002901bb33"
      ],
      "support_count": 3,
      "eligible_sample_count": 8,
      "confidence": "high",
      "scope": "适用于本风格生成；遵循事实和身份边界",
      "exceptions": [
        "案例型可先给语境；续集型可以简短承接前一期。"
      ],
      "validation": {
        "method": "semantic review with timestamp evidence",
        "criterion": "开头用一句可辨认的判断或冲突承诺本片要解释什么，不加空泛自我介绍。"
      }
    },
    {
      "id": "narrative.highlight_reprise",
      "dimension": "narrative",
      "observation": "样本1、2、7把后段论述高光前置，正文中再出现相应表达。",
      "instruction": "仅在确有强概括句时前置高光，随后建立背景；不要把所有视频都剪成重复开场。",
      "strength": "optional",
      "evidence_ids": [
        "E0024",
        "E0025",
        "E0026"
      ],
      "support_sample_ids": [
        "6a68970e000000000401f3f7",
        "6ab4292f0000000014003d92",
        "6abf912a000000001b0305b4"
      ],
      "support_count": 3,
      "eligible_sample_count": 8,
      "confidence": "high",
      "scope": "适用于本风格生成；遵循事实和身份边界",
      "exceptions": [
        "样本3、4、5、6、8没有同样的前置高光重述结构。"
      ],
      "validation": {
        "method": "semantic review with timestamp evidence",
        "criterion": "仅在确有强概括句时前置高光，随后建立背景；不要把所有视频都剪成重复开场。"
      }
    },
    {
      "id": "narrative.concrete_application",
      "dimension": "narrative",
      "observation": "不同片型以生活情境、角色代入或具体练习把抽象机制落地。",
      "instruction": "至少给出一个与新选题有关的具体情境、解释或行动示范；禁止从旧片搬事实。",
      "strength": "preferred",
      "evidence_ids": [
        "E0027",
        "E0028",
        "E0029",
        "E0030",
        "E0031",
        "E0032",
        "E0033",
        "E0034"
      ],
      "support_sample_ids": [
        "6a1ac97b00000000350322e7",
        "6a68970e000000000401f3f7",
        "6a7879970000000026035790",
        "6a8eb2d800000000200363a9",
        "6aa2915d0000000025034163",
        "6aaa8d79000000002901bb33",
        "6ab4292f0000000014003d92",
        "6abf912a000000001b0305b4"
      ],
      "support_count": 8,
      "eligible_sample_count": 8,
      "confidence": "high",
      "scope": "适用于本风格生成；遵循事实和身份边界",